{
  "schema_version": "1.0.0",
  "last_updated": "2026-04-06",
  "source": "European Commission - VAT Rates Database",
  "countries": {
    "AT": {
      "name": "Austria",
      "code": "AT",
      "currency": "EUR",
      "vat": { "standard": 20, "reduced": 10, "super_reduced": null, "parking": 13, "zero": 0 },
      "digital_services": {
        "classification": "digital_service",
        "b2b": { "rate": 0, "mechanism": "reverse_charge", "condition": "Valid VAT number required" },
        "b2c": { "rate": 20, "mechanism": "standard", "threshold_oss": { "amount": 10000, "currency": "EUR", "note": "Below €10k: apply home country VAT" } }
      },
      "saas": {
        "classification": "digital_service",
        "b2b": { "rate": 0, "mechanism": "reverse_charge" },
        "b2c": { "rate": 20, "mechanism": "standard" }
      },
      "ebooks": {
        "classification": "digital_service",
        "b2b": { "rate": 0, "mechanism": "reverse_charge" },
        "b2c": { "rate": 10, "mechanism": "standard" },
        "note": "E-books qualify for reduced rate (10%) in Austria"
      },
      "online_courses": {
        "classification": "digital_service",
        "b2b": { "rate": 0, "mechanism": "reverse_charge" },
        "b2c": { "rate": 20, "mechanism": "standard" }
      },
      "notes": "Digital services: telecom, broadcasting, e-services per EU VAT Directive",
      "valid_from": "2024-01-01",
      "last_change": "2024-01-01"
    },
    "BE": {
      "name": "Belgium",
      "code": "BE",
      "currency": "EUR",
      "vat": { "standard": 21, "reduced": 6, "super_reduced": null, "parking": 12, "zero": 0 },
      "digital_services": {
        "classification": "digital_service",
        "b2b": { "rate": 0, "mechanism": "reverse_charge", "condition": "Valid VAT number required" },
        "b2c": { "rate": 21, "mechanism": "standard", "threshold_oss": { "amount": 10000, "currency": "EUR" } }
      },
      "saas": {
        "classification": "digital_service",
        "b2b": { "rate": 0, "mechanism": "reverse_charge" },
        "b2c": { "rate": 21, "mechanism": "standard" }
      },
      "ebooks": {
        "classification": "digital_service",
        "b2b": { "rate": 0, "mechanism": "reverse_charge" },
        "b2c": { "rate": 6, "mechanism": "standard" },
        "note": "E-books qualify for reduced rate (6%) in Belgium"
      },
      "online_courses": {
        "classification": "digital_service",
        "b2b": { "rate": 0, "mechanism": "reverse_charge" },
        "b2c": { "rate": 21, "mechanism": "standard" }
      },
      "valid_from": "2024-01-01",
      "last_change": "2024-01-01"
    },
    "BG": {
      "name": "Bulgaria",
      "code": "BG",
      "currency": "BGN",
      "vat": { "standard": 20, "reduced": 9, "super_reduced": null, "parking": null, "zero": 0 },
      "digital_services": {
        "classification": "digital_service",
        "b2b": { "rate": 0, "mechanism": "reverse_charge" },
        "b2c": { "rate": 20, "mechanism": "standard", "threshold_oss": { "amount": 10000, "currency": "EUR" } }
      },
      "saas": {
        "classification": "digital_service",
        "b2b": { "rate": 0, "mechanism": "reverse_charge" },
        "b2c": { "rate": 20, "mechanism": "standard" }
      },
      "ebooks": {
        "classification": "digital_service",
        "b2b": { "rate": 0, "mechanism": "reverse_charge" },
        "b2c": { "rate": 9, "mechanism": "standard" },
        "note": "E-books qualify for reduced rate (9%) in Bulgaria"
      },
      "online_courses": {
        "classification": "digital_service",
        "b2b": { "rate": 0, "mechanism": "reverse_charge" },
        "b2c": { "rate": 20, "mechanism": "standard" }
      },
      "valid_from": "2024-01-01",
      "last_change": "2024-01-01"
    },
    "CY": {
      "name": "Cyprus",
      "code": "CY",
      "currency": "EUR",
      "vat": { "standard": 19, "reduced": 9, "super_reduced": 5, "parking": null, "zero": 0 },
      "digital_services": {
        "classification": "digital_service",
        "b2b": { "rate": 0, "mechanism": "reverse_charge" },
        "b2c": { "rate": 19, "mechanism": "standard", "threshold_oss": { "amount": 10000, "currency": "EUR" } }
      },
      "saas": {
        "classification": "digital_service",
        "b2b": { "rate": 0, "mechanism": "reverse_charge" },
        "b2c": { "rate": 19, "mechanism": "standard" }
      },
      "ebooks": {
        "classification": "digital_service",
        "b2b": { "rate": 0, "mechanism": "reverse_charge" },
        "b2c": { "rate": 9, "mechanism": "standard" },
        "note": "E-books qualify for reduced rate (9%) in Cyprus"
      },
      "online_courses": {
        "classification": "digital_service",
        "b2b": { "rate": 0, "mechanism": "reverse_charge" },
        "b2c": { "rate": 19, "mechanism": "standard" }
      },
      "valid_from": "2024-01-01",
      "last_change": "2024-01-01"
    },
    "CZ": {
      "name": "Czech Republic",
      "code": "CZ",
      "currency": "CZK",
      "vat": { "standard": 21, "reduced": 12, "super_reduced": null, "parking": null, "zero": 0 },
      "digital_services": {
        "classification": "digital_service",
        "b2b": { "rate": 0, "mechanism": "reverse_charge" },
        "b2c": { "rate": 21, "mechanism": "standard", "threshold_oss": { "amount": 10000, "currency": "EUR" } }
      },
      "saas": {
        "classification": "digital_service",
        "b2b": { "rate": 0, "mechanism": "reverse_charge" },
        "b2c": { "rate": 21, "mechanism": "standard" }
      },
      "ebooks": {
        "classification": "digital_service",
        "b2b": { "rate": 0, "mechanism": "reverse_charge" },
        "b2c": { "rate": 12, "mechanism": "standard" },
        "note": "E-books qualify for reduced rate (12%) in Czech Republic"
      },
      "online_courses": {
        "classification": "digital_service",
        "b2b": { "rate": 0, "mechanism": "reverse_charge" },
        "b2c": { "rate": 21, "mechanism": "standard" }
      },
      "valid_from": "2024-01-01",
      "last_change": "2024-01-01"
    },
    "DE": {
      "name": "Germany",
      "code": "DE",
      "currency": "EUR",
      "vat": { "standard": 19, "reduced": 7, "super_reduced": null, "parking": null, "zero": 0 },
      "digital_services": {
        "classification": "digital_service",
        "b2b": { "rate": 0, "mechanism": "reverse_charge" },
        "b2c": { "rate": 19, "mechanism": "standard", "threshold_oss": { "amount": 10000, "currency": "EUR" } }
      },
      "saas": {
        "classification": "digital_service",
        "b2b": { "rate": 0, "mechanism": "reverse_charge" },
        "b2c": { "rate": 19, "mechanism": "standard" }
      },
      "ebooks": {
        "classification": "digital_service",
        "b2b": { "rate": 0, "mechanism": "reverse_charge" },
        "b2c": { "rate": 7, "mechanism": "standard" },
        "note": "E-books qualify for reduced rate (7%) in Germany"
      },
      "online_courses": {
        "classification": "digital_service",
        "b2b": { "rate": 0, "mechanism": "reverse_charge" },
        "b2c": { "rate": 19, "mechanism": "standard" }
      },
      "valid_from": "2024-01-01",
      "last_change": "2024-01-01"
    },
    "DK": {
      "name": "Denmark",
      "code": "DK",
      "currency": "DKK",
      "vat": { "standard": 25, "reduced": null, "super_reduced": null, "parking": null, "zero": 0 },
      "digital_services": {
        "classification": "digital_service",
        "b2b": { "rate": 0, "mechanism": "reverse_charge" },
        "b2c": { "rate": 25, "mechanism": "standard", "threshold_oss": { "amount": 10000, "currency": "EUR" } }
      },
      "saas": {
        "classification": "digital_service",
        "b2b": { "rate": 0, "mechanism": "reverse_charge" },
        "b2c": { "rate": 25, "mechanism": "standard" }
      },
      "ebooks": {
        "classification": "digital_service",
        "b2b": { "rate": 0, "mechanism": "reverse_charge" },
        "b2c": { "rate": 25, "mechanism": "standard" },
        "note": "Denmark applies standard rate (25%) to e-books"
      },
      "online_courses": {
        "classification": "digital_service",
        "b2b": { "rate": 0, "mechanism": "reverse_charge" },
        "b2c": { "rate": 25, "mechanism": "standard" }
      },
      "valid_from": "2024-01-01",
      "last_change": "2024-01-01"
    },
    "EE": {
      "name": "Estonia",
      "code": "EE",
      "currency": "EUR",
      "vat": { "standard": 22, "reduced": 9, "super_reduced": null, "parking": null, "zero": 0 },
      "digital_services": {
        "classification": "digital_service",
        "b2b": { "rate": 0, "mechanism": "reverse_charge" },
        "b2c": { "rate": 22, "mechanism": "standard", "threshold_oss": { "amount": 10000, "currency": "EUR" } }
      },
      "saas": {
        "classification": "digital_service",
        "b2b": { "rate": 0, "mechanism": "reverse_charge" },
        "b2c": { "rate": 22, "mechanism": "standard" }
      },
      "ebooks": {
        "classification": "digital_service",
        "b2b": { "rate": 0, "mechanism": "reverse_charge" },
        "b2c": { "rate": 9, "mechanism": "standard" },
        "note": "E-books qualify for reduced rate (9%) in Estonia"
      },
      "online_courses": {
        "classification": "digital_service",
        "b2b": { "rate": 0, "mechanism": "reverse_charge" },
        "b2c": { "rate": 22, "mechanism": "standard" }
      },
      "notes": "Standard rate changing to 22% (was 20% before 2025).",
      "valid_from": "2025-01-01",
      "last_change": "2025-01-01"
    },
    "EL": {
      "name": "Greece",
      "code": "EL",
      "currency": "EUR",
      "vat": { "standard": 24, "reduced": 13, "super_reduced": 6, "parking": null, "zero": 0 },
      "digital_services": {
        "classification": "digital_service",
        "b2b": { "rate": 0, "mechanism": "reverse_charge" },